{"advisory_only":true,"authority_locks":{"authorization_record_creation":false,"canon_mutation":false,"canonical_source_selection":false,"code_generation":false,"code_mutation":false,"contracts_codegen_directory_creation":false,"core_codegen_directory_creation":false,"decision_record_creation":false,"execution":false,"file_writeback":false,"forecast_routing":false,"github_writeback":false,"implementation_authorization":false,"implementation_unblock":false,"merge_anchor_mutation":false,"notion_writeback":false,"operator_attestation":false,"patch_application":false,"runtime_mutation":false,"scheduler_mutation":false,"source_promotion":false},"decision_record_created":false,"dry_run_hash":"f67207c419ef9c7d0b1923f71c4d7175e268b5fb70acac8c305685b9fc5c4a99","dry_run_id":"abx_codegen_merge_anchor_source_selection_decision_record_dry_run_001","execution_authority":false,"implementation_authorized":false,"non_authoritative":true,"operator_decision_attested":false,"operator_input_required":true,"projection_only":true,"recommended_next_patch":"NOT_COMPUTABLE","safe_to_auto_continue":false,"schema_version":"AbxCodegenMergeAnchorSourceSelectionDecisionRecordDryRun.v1","simulated_decision_record":{"acknowledgement_fields":["advisory_only_acknowledged","projection_only_acknowledged","non_authoritative_acknowledged","agent_source_selection_denied_acknowledged","implementation_authority_denied_acknowledged","execution_authority_denied_acknowledged","notion_writeback_denied_acknowledged","github_writeback_denied_acknowledged","runtime_mutation_denied_acknowledged","canon_mutation_denied_acknowledged"],"artifact_type":"AbxCodegenMergeAnchorSourceSelectionDecisionRecord.v1.simulated","canonical_source_selection_authorized":false,"decision_fields":["selected_decision","decision_rationale","decision_scope_acknowledged","source_selection_request_hash_acknowledged","normalization_plan_hash_acknowledged","no_implementation_unblock_acknowledged"],"decision_rationale":"SIMULATED_PENDING_OPERATOR_INPUT","decision_record_created":false,"decision_record_hash":"SIMULATED_PENDING_OPERATOR_INPUT","decision_record_id":"abx_codegen_merge_anchor_source_selection_decision_record_001.simulated","evidence_fields":["reviewed_source_selection_request_id","reviewed_source_selection_request_hash","reviewed_normalization_plan_hash","reviewed_source_selection_requests"],"execution_authority":false,"implementation_authorized":false,"operator_decision_attested":false,"operator_identity_fields":["operator_id","operator_name","operator_role","decision_timestamp_utc"],"per_anchor_decisions":[{"anchor_id":"prompting_upgrade_stack_v0_1","authority_boundary_acknowledgement":"SIMULATED_PENDING_OPERATOR_INPUT","canonical_source_page_id_or_url":"NOT_COMPUTABLE","canonical_source_title":"NOT_COMPUTABLE","implementation_unblocked":false,"operator_attested":false,"operator_rationale":"SIMULATED_PENDING_OPERATOR_INPUT","selected_decision":"MAINTAIN_HOLD","source_evidence_hash":"e6508a0deab6c67cc4749c8e611a0578ebd0f2d2822f4183191e8faba0a61efa"},{"anchor_id":"code_drop_envelope_rule","authority_boundary_acknowledgement":"SIMULATED_PENDING_OPERATOR_INPUT","canonical_source_page_id_or_url":"82996cf1-0784-4114-ab44-eccb5b054a09","canonical_source_title":"ABX Code Drop Envelope - abx-familiar v0.1","implementation_unblocked":false,"operator_attested":false,"operator_rationale":"SIMULATED_PENDING_OPERATOR_INPUT","selected_decision":"MAINTAIN_HOLD","source_evidence_hash":"d880af448a2bd5491972b8512c60086488b2af4c99cfbc45b60b6b19aac5a6b5"},{"anchor_id":"subsystem_merge_map_002","authority_boundary_acknowledgement":"SIMULATED_PENDING_OPERATOR_INPUT","canonical_source_page_id_or_url":"3553e8ba-2f5c-8111-ba0a-d9fb4a121906","canonical_source_title":"Abraxas + AAL - Canon Surfaces Merge Map v1.0","implementation_unblocked":false,"operator_attested":false,"operator_rationale":"SIMULATED_PENDING_OPERATOR_INPUT","selected_decision":"MAINTAIN_HOLD","source_evidence_hash":"8c0dc3bcc6c73b6e0220b2672e505e68d0cf6947b7b86b8286bf120b9f746af8"},{"anchor_id":"system_state_snapshot_authoritative","authority_boundary_acknowledgement":"SIMULATED_PENDING_OPERATOR_INPUT","canonical_source_page_id_or_url":"29a45e68-021c-4965-8fd8-3178ee3dfda6","canonical_source_title":"Abraxas - System State Snapshot (Authoritative)","implementation_unblocked":false,"operator_attested":false,"operator_rationale":"SIMULATED_PENDING_OPERATOR_INPUT","selected_decision":"MAINTAIN_HOLD","source_evidence_hash":"270988a5190c46e08d82514d215bb7499376ef5ff8190c5058ae73a45fbf59bf"},{"anchor_id":"all","authority_boundary_acknowledgement":"SIMULATED_PENDING_OPERATOR_INPUT","canonical_source_page_id_or_url":"NOT_APPLICABLE","canonical_source_title":"NOT_APPLICABLE","implementation_unblocked":false,"operator_attested":false,"operator_rationale":"SIMULATED_PENDING_OPERATOR_INPUT","selected_decision":"MAINTAIN_HOLD","source_evidence_hash":"NOT_APPLICABLE"}],"selected_decision":"MAINTAIN_HOLD","simulated_only":true,"valid_for_execution":false,"valid_for_implementation":false},"simulated_only":true,"source_plan_hash":"69ed1191071404b5997d047419e84cbc0b0ea47e8344ded0b5e8d2f0bea332f3","source_plan_path":"out/operator_review/abx_codegen_merge_anchor_source_selection_decision_record_plan_001.latest.json","source_plan_ready":true,"status":"ABX_CODEGEN_MERGE_ANCHOR_SOURCE_SELECTION_DECISION_RECORD_DRY_RUN_READY","valid_for_execution":false,"valid_for_implementation":false,"validation_blockers":["operator_identity_not_attested","operator_decision_not_attested","operator_rationale_not_attested","operator_acknowledgements_not_attested","operator_evidence_bundle_not_attested"],"validation_passed":true}
